title,pageid,content
Variations of basketball,5070155,"Variations of basketball are games or activities based on, or similar in origin to, the game of basketball, in which the player utilizes common basketball skills. Some are essentially identical to basketball, with only minor rules changes, while others are more distant and arguably not simple variations but distinct games. Other variations include children's games, contests or activities intended to help the player practice or reinforce skills, which may or may not have a competitive aspect. Most of the variations are played in informal settings, without the presence of referees or other officials and sometimes without strict adherence to official game rules."
Center (basketball),652569,"The center (C), or the centre, also known as the five, the big or the pivot, is one of the five positions in a regulation basketball game. The center is almost always the tallest player on the team, and often has a great deal of strength and body mass as well. In the NBA, the center is typically close to 7 feet (2.13 m) tall; centers in the WNBA are typically above 6 feet 4 inches (1.93 m). Centers traditionally play close to the basket in the low post. The two tallest players in NBA history, Manute Bol and Gheorghe Mureșan, were both centers, each standing 7 feet 7 inches (2.31 m) tall. Centers are valued for their ability to protect their own goal from high-percentage close attempts on defense, while scoring and rebounding with high efficiency on offense. In the 1950s and 1960s, George Mikan and Bill Russell were centerpieces of championship dynasties and defined early prototypical centers. With the addition of a three-point field goal for the 1979–80 season, however, NBA basketball gradually became more perimeter-oriented and saw the importance of a traditional center diminish. Modern day big men include elite playmakers and passers such as Nikola Jokic and versatile scorers such as Joel Embiid and Victor Wembanyama."
Isaiah Thomas (basketball),21374258,"Isaiah Jamar Thomas (born February 7, 1989) is an American professional basketball player for the Salt Lake City Stars of the NBA G League. He most notably played with the Boston Celtics from 2015 through 2017, when he was a two-time NBA All-Star and named second-team All-NBA. The 5-foot-9-inch (1.75 m) point guard played three years of college basketball for the Washington Huskies and was a three-time all-conference selection in the Pac-10. After electing to forgo his senior year of college, Thomas was selected by the Sacramento Kings with the final pick in the 2011 NBA draft. He spent three seasons with the Kings before joining the Phoenix Suns in 2014. Thomas was traded to Boston in February 2015. In the 2016–17 season, he led the Celtics to the first seed of the Eastern Conference, had the third-highest points-per-game average in the league, and finished fifth in MVP voting. After injuring his right hip during the 2016–17 season, Thomas was traded to the Cleveland Cavaliers in August 2017. Over the next several seasons, his hip injury significantly hampered his play. Thomas went on to play for the Los Angeles Lakers, Denver Nuggets, Washington Wizards, New Orleans Pelicans, Dallas Mavericks, Charlotte Hornets, and Suns again, along with several stints in the NBA G League."
Basketball at the 2024 Summer Olympics,71954473,"The basketball competitions at the 2024 Summer Olympics in Paris, France, were held from 27 July to 11 August 2024. Preliminary 5x5 basketball matches occurred at Stade Pierre-Mauroy in Lille, with the final phase staged at the Bercy Arena (not referred to as the Accor Arena due to IOC rules disallowing Olympic host venues to be named after corporate sponsors) in Paris. Retaining its position in the program, the 3x3 competitions were played at Place de la Concorde."
Greek Basketball Cup Finals MVP,50148034,"The Greek Basketball Cup Finals MVP is an annual award that is given to the most valuable player of the Finals of the Greek Basketball Cup, which is the top-tier level national domestic professional men's cup competition of the sport of basketball, in the country of Greece. The Greek Basketball Cup is contested between the top seven placed teams from each first half season of the top-tier level Greek Basket League, and the winners of the second-tier level Greek national basketball cup competition, the Greek UNICEF Cup."
American Basketball Association (2000–present),1997358,"The American Basketball Association (ABA) is an American semi-professional men's basketball minor league that was founded in 1999. ABA teams are based in the United States, with one traveling team from Japan. The league previously had international teams based in Canada, China and Mexico. League management infamously maintains low requirements for franchise ownership, and hundreds of ABA teams have either folded or defected to rival leagues. The league licenses its name and use of ABA trademarks from the National Basketball Association, which absorbed the American Basketball Association (1967–1976) during the ABA–NBA merger. The Women's American Basketball Association has operated as a sister league to the ABA since 2017."
Basketball England,8501755,"Basketball England (BE, formally England Basketball) (formerly known as the Amateur Basketball Association) is the governing body of the sport of basketball for England including 3x3 basketball. The organisation operates the English Basketball League for both men and women, as well as the England national team. The organisation was also involved in the establishment of the Great Britain team in December 2005, along with its compatriots – Basketball Scotland and Basketball Wales. Whilst the organisation governs the British Basketball League, the country's elite and only professional basketball league, they are not involved in the day-to-day running of the league. They also offer the opportunity to play basketball. The organisation was founded in 1936. It is a non-profit organisation which is an association of member clubs and players who elect an Executive Board to administer their affairs. The Executive Board employ a number of professional staff to enable it to undertake its duties and achieve its aims. The headquarters of the organisation is in Belle Vue, Manchester."
Advanced statistics in basketball,3355871,"Advanced statistics, also known as analytics or APBRmetrics, in basketball refers to the analysis of basketball statistics using objective evidence. APBRmetrics takes its name from the acronym APBR, which stands for the Association for Professional Basketball Research. According to The Sporting News, the APBRmetrics message board was ""the birthplace of basketball analytics"". Advanced basketball statistics include effective field goal percentage (eFG%), true shooting percentage (TS%), on-court/off-court plus–minus, adjusted plus-minus (APM), real plus/minus (RPM), player efficiency rating (PER), offense efficiency rating, offensive rating, defensive rating, similarity score, tendex, and player tracking. A more complete explanation of basketball analytics is available in ""A Starting Point for Analyzing Basketball Statistics"" in the Journal of Quantitative Analysis in Sports."
Basketball scorekeeping,4025654,"Points in basketball are used to keep track of the score in a game. Points can be accumulated by making field goals (two or three points) or free throws (one point). The team that has recorded the most points at the end of a game is declared that game's winner. If a player makes a field goal from within the three-point line, the player scores two points; if that player is fouled in the act of shooting, a made free throw turns it into a three-point play. If a player makes a field goal from beyond the three-point line, the player scores three points; if that player is fouled in the act of shooting, a made free throw turns it into a four-point play. "
Women's National Basketball Association,57721,"The Women's National Basketball Association (WNBA) is a women's professional basketball league in the United States. The league comprises 13 teams (scheduled to expand to 15 in 2026). It is considered the premier professional women's basketball league in the world. The WNBA is headquartered in Midtown Manhattan. The WNBA was founded on April 24, 1996, as the women's counterpart to the National Basketball Association (NBA); league play began in 1997. The regular season runs from May to September, with each team playing 44 games. The top eight teams (regardless of conference) qualify for the playoffs, culminating in the WNBA Finals, which is played in October. The All-Star Game occurs midway through the season in July. The league hosts an annual mid-season competition, the Commissioner's Cup. The WNBA is an active member of USA Basketball (USAB), which is recognized by the International Basketball Federation (FIBA) as the governing body for basketball in the United States."
Double-double,23178183,"In basketball, a double-double is a single-game performance in which a player accumulates ten or more in two of the following five statistical categories: points, rebounds, assists, steals, and blocked shots. The first ""double"" in the term refers to the two (double) categories and the second ""double"" refers to accumulating ten or more (typically double digits) in that category. Similarly, a player records a triple-double, quadruple-double, and quintuple-double when accumulating ten or more in three, four, or all five of the statistical categories, respectively. While double-doubles and triple-doubles occur regularly each NBA season, only four quadruple-doubles have ever officially been recorded in the NBA, and no quintuple-double has ever been recorded in a professional basketball game. A similar term, the five-by-five, is the accumulation of at least five in all five statistical categories. It is rarely done."
